{"model":{"file":"model.json","hash":"sha256:3d04efad77399afd3ba2bc0d2d09c4142755bc3a7395d4c19d9fa15cc7554017"},"modelHash":"sha256:06be66564654b8ff9d1a808a6dec5331d1553974daad9d56c9e018c5b454d7dc","scenes":{"e/billing":{"file":"scene/e/billing.json","hash":"sha256:39a084f205548a69c2c9541d72016ee81cfb7da8c4d8e136181c518684f4d8e3"},"e/billing/api":{"file":"scene/e/billing/api.json","hash":"sha256:19646425ebe53880d07b31889b76eb2d3094393e329108ba1ce70794555c942d"},"landscape":{"file":"scene/landscape.json","hash":"sha256:46ed5c1793c1e880160ff8c5f31f141c15f0f1d6511b6642d2196233a4ec8d27"},"v/billing-containers":{"file":"scene/v/billing-containers.json","hash":"sha256:87a4a46d88c07c6c520e26584fe590e1b884d15c8b98d1273cd5b2c68f63691c"},"v/landscape":{"file":"scene/v/landscape.json","hash":"sha256:0d396d3bf9331054e4ee777a3acffb19c4ae3892203dbbb70bc0170a7daf2a06"}},"schema":"buildzr.index/2"}
