{"model":{"file":"model.d17e5944.json","hash":"sha256:d17e5944cb946b03b69cbcf80bc88084d06921ad9b452436d328027ffc4a4498"},"modelHash":"sha256:79288b1fe9504a57cb949fb0708d2417ec651fc79440eeb9162b6a466fe28ade","scenes":{"e/shop":{"file":"scene/e/shop.1b9273ce.json","hash":"sha256:1b9273ce26987f1d4e167294c8b3ddde80dfd7b84ada045cb7d8d335f5a35aea"},"landscape":{"file":"scene/landscape.131093aa.json","hash":"sha256:131093aa76d0688716574d41f3e213f1508cc57ad97211e2a4b09d5cfa1d10d2"},"v/checkout":{"file":"scene/v/checkout.6abd2831.json","hash":"sha256:6abd2831ef4af27788bc745dc2dd22d1e375bcc88e1b3da85d0fb9f22976db33"},"v/shop-containers":{"file":"scene/v/shop-containers.83d47552.json","hash":"sha256:83d47552faf62899b1d3e015de67c6aa00abc03a17d3b2ed13b82a1e2b0ecf2f"},"v/sign-in":{"file":"scene/v/sign-in.00a96d6b.json","hash":"sha256:00a96d6bb6de7fe0a12c638439448e05c18b99c3022d3fcb52946b53b08ea2e4"}},"schema":"buildzr.index/2"}
