{"model":{"file":"model.5eb596cd.json","hash":"sha256:5eb596cd04f0ddaff0269342b91c851176e4f341a5f805dc7664afcce0ced7b1"},"modelHash":"sha256:8d1715251b439bf7d5b8d1a8b6b8235de99feaaa9f0a43a3d6a50e26b10d7d56","scenes":{"e/mes":{"file":"scene/e/mes.0cb0d0d7.json","hash":"sha256:0cb0d0d71c02c5b9710707322ca86f0b44530aa97fbea2994cf41afbe4f63f7f"},"landscape":{"file":"scene/landscape.95d11916.json","hash":"sha256:95d11916af2b70dddc57080463e6dbc4070da036d405aa02fae887226e419dbb"},"v/devices":{"file":"scene/v/devices.ea5ebf36.json","hash":"sha256:ea5ebf3699788eb03b117962f99d7162f559bd0292e297c7681855e200191fc2"},"v/landscape":{"file":"scene/v/landscape.c453ef6f.json","hash":"sha256:c453ef6f2f28f529e0ef3c111a5e8c7efaa0e688fa18279aefc8bf9adc04d89f"},"v/mes-containers":{"file":"scene/v/mes-containers.99ac10ba.json","hash":"sha256:99ac10baf9f57a47ff9070b173f8edd58a2d6ef97f1ca6fa0cb3a6a7b8132646"},"v/sensing":{"file":"scene/v/sensing.9ed334e7.json","hash":"sha256:9ed334e7a771b7a4bccd8d9fee42f5f814b89034ef2cb1c5ddbc2e6d9207030b"}},"schema":"buildzr.index/2"}
