{"branding":{"file":"branding.01766eff.json","hash":"sha256:01766eff0c3d691fbd0e8dea305158c39c30a50941f0f489aae339bd29223610"},"model":{"file":"model.243e78c9.json","hash":"sha256:243e78c9bbf0b1d65e7abeb40cd17dbb6eba41596e803d881150e4cc89f9df3e"},"modelHash":"sha256:b0cf156adc346f31f0af8891747e6e049f70c412b3eec0eee5170e501b0213a7","scenes":{"e/shop":{"file":"scene/e/shop.73e6fd1a.json","hash":"sha256:73e6fd1a0b77934e0699420462ddae803c073d9a9b5aed6be01855c5d25a4d10"},"landscape":{"file":"scene/landscape.22952d47.json","hash":"sha256:22952d473b6f42f38e356b5fb593c4316cefad22cf03b9d48fc2e545d48b9efb"},"v/landscape":{"file":"scene/v/landscape.42244f37.json","hash":"sha256:42244f37ab33bdcb34a7ba8676c3c8ef6e435bb14437a47b169ceb354d84f2a6"},"v/shop":{"file":"scene/v/shop.fb588d66.json","hash":"sha256:fb588d66acb23de956501984ccaeefcac9292ed6be89b59fd42360e589b0d5a4"}},"schema":"buildzr.index/2"}
