{"model":{"file":"model.3c548349.json","hash":"sha256:3c548349c1cb20d060b6aed7d1e6559a2bb2771f107e287d2653745107d23cb4"},"modelHash":"sha256:7d6760e21444d2c3bc5b95212ab6b16e06ad6b9759ecdb290c99e216f598202a","scenes":{"e/shop":{"file":"scene/e/shop.e1cb9636.json","hash":"sha256:e1cb9636197583ac0dbadf6875b1fb37b926e196de5e4e1ca6fef8bc1965c250"},"landscape":{"file":"scene/landscape.145a4557.json","hash":"sha256:145a4557c3184da27b9be8328922d4fba3eab8f9533b1e70de9c970bbbb4cc19"},"v/landscape":{"file":"scene/v/landscape.bb9ecd9e.json","hash":"sha256:bb9ecd9e2cf520c7c67fae39afea70e54ffafaeee3c6c12aeb8fd04b4364b793"},"v/production":{"file":"scene/v/production.f6997647.json","hash":"sha256:f699764787428c6d13655bdc59bc9132abb75d1b7ed6bc83ef62880c3493de77"},"v/shop-containers":{"file":"scene/v/shop-containers.662405ca.json","hash":"sha256:662405ca2073438479397bba34706a0a542fd1878bb6025943469fe5bdc552aa"},"v/staging":{"file":"scene/v/staging.a2f4b3a3.json","hash":"sha256:a2f4b3a3bd2befdab7e91c7837e93326ed635a25fa7631f83a0b44a29514da6c"}},"schema":"buildzr.index/2"}
