{"model":{"file":"model.2e2ed2e5.json","hash":"sha256:2e2ed2e5e12a6a67c87e00cd8cf816707be4cd6c62a21ec457e1745690a723a7"},"modelHash":"sha256:38854a9350212aa1f05a3a91e7d4dd19a19c8f559f2413fedaf4081dddc0805b","scenes":{"e/back-office":{"file":"scene/e/back-office.facda6d5.json","hash":"sha256:facda6d59e20738ee4e1c68cd400c48acb77b77b0ca3ee1b9089b6def2d3e820"},"e/online-shop":{"file":"scene/e/online-shop.4ea4d3c8.json","hash":"sha256:4ea4d3c8f5f5a2a6369a2830bd5e713caf89bc2636acd602fa349400bd77c3ed"},"e/online-shop/order-service":{"file":"scene/e/online-shop/order-service.37ec0232.json","hash":"sha256:37ec02323e749fbe0e0030985b4401596c507e078f213335e0d11038fac37f48"},"landscape":{"file":"scene/landscape.682475b7.json","hash":"sha256:682475b7c67c52c0c4750d631974accae0d2f52311785bbda503949a77e877e0"},"v/landscape":{"file":"scene/v/landscape.0a0d88ae.json","hash":"sha256:0a0d88aed3ac5aaf460a5fc7f2f1d06c8e8db262fc6af05e48e3bc1e6cc446f7"},"v/orders-components":{"file":"scene/v/orders-components.cef6dda8.json","hash":"sha256:cef6dda801e59a7f2b8275352d087e12f08d96a505c1c2314da6d41fb47e67e1"},"v/place-order":{"file":"scene/v/place-order.62420040.json","hash":"sha256:624200404b89bdba35d1cb3e31168801cfe7eec77b1a51a9605ccecd278d95fc"},"v/production":{"file":"scene/v/production.115f94d4.json","hash":"sha256:115f94d48104ee02786bd4f774d02fdec429114fc500b0866c92abdea115e4ae"},"v/shop-containers":{"file":"scene/v/shop-containers.4b5e77a6.json","hash":"sha256:4b5e77a6430b3c3fbd6a6720053959e64387739012b8fe96e23deac2f7b83d34"},"v/shop-context":{"file":"scene/v/shop-context.f6053c4c.json","hash":"sha256:f6053c4c720db85fb3960435e22ec6f6fa179c5ade06922df547c443e5603fa2"}},"schema":"buildzr.index/2"}
